Symbol,Name,Last Sale,Net Change,% Change,Market Cap,Country,IPO Year,Volume,Sector,Industry
TT,Trane Technologies plc,$351.87,4.20,1.208%,79406584182.00,Ireland,,339899,Industrials,Auto Parts:O.E.M.
TTE,TotalEnergies SE,$68.93,0.28,0.408%,158647281517.00,France,,654763,Energy,Oil & Gas Production
TU,Telus Corporation Ordinary Shares,$15.935,0.045,0.283%,23520060000.00,Canada,,940744,Telecommunications,Telecommunications Equipment
TVE,Tennessee Valley Authority,$22.3099,0.1499,0.676%,17757030360.00,United States,,4406,Utilities,Electric Utilities: Central
TXT,Textron Inc. Common Stock,$88.20,0.26,0.296%,16525376910.00,United States,,399749,Industrials,Aerospace
TYL,Tyler Technologies Inc. Common Stock,$579.355,2.725,0.473%,24722621252.00,United States,,88769,Technology,Computer Software: Prepackaged Software
UBER,Uber Technologies Inc. Common Stock,$73.175,-0.135,-0.184%,153736081732.00,United States,2019,6479411,Consumer Discretionary,Business Services
UBS,UBS Group AG Registered Ordinary Shares,$30.645,0.185,0.607%,106031700000.00,Switzerland,2014,1440419,Finance,Major Banks
UDR,UDR Inc. Common Stock,$42.32,0.22,0.523%,13958133102.00,United States,,796355,Real Estate,Real Estate Investment Trusts
UHAL,U-Haul Holding Company Common Stock,$70.23,0.68,0.978%,13770549512.00,United States,2022,51242,Consumer Discretionary,Rental/Leasing Companies
UHS,Universal Health Services Inc. Common Stock,$228.03,0.47,0.207%,15212600963.00,United States,,293848,Health Care,Hospital/Nursing Management
UI,Ubiquiti Inc. Common Stock,$180.12,2.07,1.163%,10890308269.00,United States,,8479,Technology,Radio And Television Broadcasting And Communications Equipment
UL,Unilever PLC Common Stock,$61.845,0.485,0.79%,154207419270.00,United Kingdom,,1059058,Consumer Discretionary,Package Goods/Cosmetics
ULS,UL Solutions Inc. Class A Common Stock,$53.31,0.36,0.68%,10662370451.00,,2024,135576,Health Care,Precision Instruments
UMC,United Microelectronics Corporation (NEW) Common Stock,$8.90,0.13,1.482%,22303083445.00,Taiwan,,5963389,Technology,Semiconductors
UNH,UnitedHealth Group Incorporated Common Stock (DE),$579.83,-0.82,-0.141%,535425545915.00,United States,,1118022,Health Care,Medical Specialities
UNM,Unum Group Common Stock,$53.91,-0.15,-0.277%,10014996068.00,United States,,475844,Finance,Accident &Health Insurance
UNP,Union Pacific Corporation Common Stock,$245.90,-0.60,-0.243%,149801696725.00,United States,,668044,Industrials,Railroads
UPS,United Parcel Service Inc. Common Stock,$128.245,-0.635,-0.493%,109851823039.00,United States,1999,2572366,Industrials,Trucking Freight/Courier Services
URI,United Rentals Inc. Common Stock,$724.95,8.71,1.216%,47945199681.00,United States,1997,114688,Consumer Discretionary,Diversified Commercial Services
USB,U.S. Bancorp Common Stock,$43.54,-0.20,-0.457%,67944780997.00,United States,,2055716,Finance,Major Banks
USFD,US Foods Holding Corp. Common Stock,$58.14,0.81,1.413%,14218630143.00,United States,2016,1678082,Consumer Discretionary,Food Distributors
UWMC,UWM Holdings Corporation Class A Common Stock,$9.4299,0.1899,2.055%,15065978606.00,United States,,1145033,Finance,Finance: Consumer Services
V,Visa Inc.,$268.42,0.38,0.142%,489143436378.00,United States,,2002103,Consumer Discretionary,Business Services
VALE,VALE S.A.  American Depositary Shares Each Representing one common share,$10.635,0.255,2.457%,48272345486.00,Brazil,,13125042,Basic Materials,Metal Mining
VEEV,Veeva Systems Inc. Class A Common Stock,$199.665,5.995,3.095%,32276189276.00,United States,2013,654686,Technology,Computer Software: Prepackaged Software
VICI,VICI Properties Inc. Common Stock,$32.16,0.17,0.531%,33677075576.00,United States,2018,1774910,Real Estate,Real Estate Investment Trusts
VIK,Viking Holdings Ltd Ordinary Shares,$36.06,0.13,0.362%,15558268165.00,,2024,1157153,Consumer Discretionary,Marine Transportation
VIV,Telefonica Brasil S.A. American Depositary Shares (Each representing One Common Share),$9.59,0.04,0.419%,15848322372.00,Brazil,2020,279091,Telecommunications,Telecommunications Equipment
VLO,Valero Energy Corporation Common Stock,$143.86,2.60,1.841%,46089937148.00,United States,,1587677,Energy,Integrated oil Companies
VLTO,Veralto Corp Common Stock ,$109.78,0.38,0.347%,27127340592.00,United States,2023,579695,Industrials,Electrical Products
VMC,Vulcan Materials Company (Holding Company) Common Stock,$248.71,3.11,1.266%,32844646579.00,United States,,358978,Industrials,Mining & Quarrying of Nonmetallic Minerals (No Fuels)
VRT,Vertiv Holdings LLC Class A Common Stock,$77.44,0.93,1.216%,29051442147.00,United States,2018,3527826,Technology,Industrial Machinery/Components
VST,Vistra Corp. Common Stock,$82.205,2.565,3.221%,28242465134.00,United States,,2747173,Utilities,Electric Utilities: Central
VTR,Ventas Inc. Common Stock,$58.77,-0.16,-0.272%,24281048062.00,United States,,559586,Real Estate,Real Estate Investment Trusts
WAB,Westinghouse Air Brake Technologies Corporation Common Stock,$161.075,0.945,0.59%,28217639094.00,United States,,144579,Industrials,Railroads
WAT,Waters Corporation Common Stock,$337.02,0.86,0.256%,20006156638.00,United States,1995,111598,Industrials,Biotechnology: Laboratory Analytical Instruments
WCN,Waste Connections Inc. Common Shares,$184.62,2.12,1.162%,47638868665.00,Canada,,406096,Utilities,Environmental Services
WDS,Woodside Energy Group Limited American Depositary Shares each representing one Ordinary Share,$17.515,0.035,0.20%,33256602239.00,Australia,2022,489192,Energy,Oil & Gas Production
WEC,WEC Energy Group Inc. Common Stock,$91.50,0.93,1.027%,28921265192.00,United States,,785743,Utilities,Power Generation
WELL,Welltower Inc. Common Stock,$116.56,0.13,0.112%,71002236213.00,United States,,1085430,Real Estate,Real Estate Investment Trusts
WES,Western Midstream Partners LP Common Units Representing Limited Partner Interests,$37.83,0.22,0.585%,14394016294.00,United States,2012,561920,Utilities,Natural Gas Distribution
WFC,Wells Fargo & Company Common Stock,$55.335,-0.815,-1.451%,188347626562.00,United States,,8232413,Finance,Major Banks
WIT,Wipro Limited Common Stock,$6.2599,0.0899,1.457%,32708842906.00,India,,490936,Technology,EDP Services
WLK,Westlake Corporation Common Stock,$145.62,1.95,1.357%,18724641188.00,United States,2004,79054,Industrials,Major Chemicals
WM,Waste Management Inc. Common Stock,$209.16,1.06,0.509%,83939009215.00,United States,,481411,Utilities,Environmental Services
WMB,Williams Companies Inc. (The) Common Stock,$44.665,0.345,0.778%,54443561646.00,United States,,1804490,Utilities,Natural Gas Distribution
WMS,Advanced Drainage Systems Inc. Common Stock,$156.33,5.82,3.867%,12119238281.00,United States,2014,232520,Consumer Discretionary,Containers/Packaging
WMT,Walmart Inc. Common Stock,$75.08,0.54,0.724%,603909233216.00,United States,,9051451,Consumer Discretionary,Department/Specialty Retail Stores
WPC,W. P. Carey Inc. REIT,$58.72,0.43,0.738%,12850696721.00,United States,,331558,Real Estate,Real Estate Investment Trusts
WPM,Wheaton Precious Metals Corp Common Shares (Canada),$61.81,0.14,0.227%,28039194555.00,Canada,,936339,Basic Materials,Precious Metals
WRB,W.R. Berkley Corporation Common Stock,$57.585,0.235,0.41%,21914006301.00,United States,,336270,Finance,Property-Casualty Insurers
WSM,Williams-Sonoma Inc. Common Stock (DE),$143.34,5.71,4.149%,18435841234.00,United States,,1809269,Consumer Discretionary,Home Furnishings
WSO,Watsco Inc. Common Stock,$481.518,9.768,2.071%,19424057647.00,United States,,53402,Consumer Discretionary,Industrial Machinery/Components
WST,West Pharmaceutical Services Inc. Common Stock,$302.965,3.845,1.285%,21977563723.00,United States,,72149,Health Care,Medical/Dental Instruments
WTRG,Essential Utilities Inc. Common Stock,$39.44,-0.09,-0.228%,10793626835.00,United States,,232921,Utilities,Water Supply
WY,Weyerhaeuser Company Common Stock,$30.335,0.225,0.747%,22063100525.00,United States,,1631141,Real Estate,Real Estate Investment Trusts
XOM,Exxon Mobil Corporation Common Stock,$114.35,-0.23,-0.201%,508037219423.00,United States,,6047960,Energy,Integrated oil Companies
XPO,XPO Inc. Common Stock,$121.345,3.605,3.062%,14123701790.00,United States,,543935,Consumer Discretionary,Transportation Services
XYL,Xylem Inc. Common Stock New,$135.685,1.535,1.144%,32956920966.00,United States,2011,1008800,Industrials,Fluid Controls
YUM,Yum! Brands Inc.,$137.935,0.985,0.719%,38782494551.00,United States,,850356,Consumer Discretionary,Restaurants
YUMC,Yum China Holdings Inc. Common Stock,$33.96,0.82,2.474%,13055025456.00,United States,2016,1298055,Consumer Discretionary,Restaurants
ZBH,Zimmer Biomet Holdings Inc. Common Stock,$111.81,0.17,0.152%,22770372049.00,United States,,371327,Health Care,Industrial Specialties
ZTO,ZTO Express (Cayman) Inc. American Depositary Shares each representing one Class A ordinary share.,$21.145,1.345,6.793%,17188065589.00,China,2016,1801069,Industrials,Trucking Freight/Courier Services
ZTS,Zoetis Inc. Class A Common Stock,$182.92,-0.68,-0.37%,82872087091.00,United States,2013,733668,Health Care,Biotechnology: Pharmaceutical Preparations
